{
  "availability": "requires-compatible-command-build",
  "buildAssociation": {
    "inventoryIdentity": "com.mastylolabs.clock@1.0.0",
    "mode": "exact-host-build-inventory",
    "state": "not-bundled"
  },
  "dataInputs": [
    "host-provided-clock-instant"
  ],
  "deliveryMode": "host-bundled-source",
  "packageId": "com.mastylolabs.clock",
  "packageVersion": "1.0.0",
  "placement": {
    "preferredRoles": [
      "sidebar-primary",
      "sidebar-secondary"
    ],
    "size": {
      "maxHeight": 2,
      "maxWidth": 6,
      "minHeight": 1,
      "minWidth": 2
    }
  },
  "runtimeDownload": false,
  "runtimeLoading": "prohibited",
  "schemaVersion": 1,
  "sourceAssociation": {
    "sourceRevision": "172X-W1-PRIVATE-CONTRACTS-v0.1",
    "sourceSha256": "64e7d13a1dc396f467922d6b4f3a0a7f98c9600c98a148e3177b367224b30707",
    "sourceUri": "packages/com.mastylolabs.clock/1.0.0/src/ClockWidget.tsx"
  },
  "type": "widget"
}
