{
  "availability": "requires-compatible-command-build",
  "buildAssociation": {
    "inventoryIdentity": "org.example.clock@1.0.0",
    "mode": "exact-host-build-inventory",
    "state": "not-bundled"
  },
  "dataInputs": [
    "host-provided-clock-instant"
  ],
  "deliveryMode": "host-bundled-source",
  "packageId": "org.example.clock",
  "packageVersion": "1.0.0",
  "placement": {
    "preferredRoles": [
      "sidebar-primary"
    ],
    "size": {
      "maxHeight": 2,
      "maxWidth": 6,
      "minHeight": 1,
      "minWidth": 2
    }
  },
  "runtimeDownload": false,
  "runtimeLoading": "prohibited",
  "schemaVersion": 1,
  "sourceAssociation": {
    "sourceRevision": "example-v1",
    "sourceSha256": "0000000000000000000000000000000000000000000000000000000000000000",
    "sourceUri": "fixtures/source/example-clock.tsx"
  },
  "type": "widget"
}
